{
  "existing_file_behavior": "overwrite_same_candidate",
  "generated_on": "2026-06-09",
  "guard": {
    "active_policy_auto_apply": false,
    "active_spec_auto_apply": false,
    "merge": false,
    "push": false,
    "requires_human_review_before_effective_change": true,
    "skill_auto_enable": false,
    "target_repo_sync": false,
    "verifier_auto_update": false
  },
  "operation_artifacts": [
    {
      "existing_file_behavior": "overwrite_same_candidate",
      "operation": "write_core_principle_change_proposal",
      "path": "docs/change-evidence/core-principle-change-proposals/20260609-governance-hub-reusable-contract-final-state.json",
      "risk": "medium",
      "sha256": "46ee6d722e6e2d92974447f63656ade7cc63da754682f338fc14db3a2c5ec247"
    }
  ],
  "operation_paths": [
    "docs/change-evidence/core-principle-change-proposals/20260609-governance-hub-reusable-contract-final-state.json",
    "docs/change-evidence/core-principle-change-patches/20260609-core-principle-change-materialization.json"
  ],
  "rollback": "Delete files listed in operation_paths. Active core principle files are untouched by this materializer.",
  "schema_version": "0.1-draft",
  "source_command": "scripts/operator.ps1 -Action CorePrincipleMaterialize"
}
